{
  "label": "Captured receipt stdout",
  "cluster": "local fixture",
  "market": {
    "symbol": "SOL-PERP",
    "base": "SOL",
    "quote": "USDC",
    "slab": "PERCOLAT_SOL_8k4q...Qp2",
    "program": "Perco1ator111111111111111111111111111111111"
  },
  "command": "execution:receipts",
  "stdoutText": "[INFO] loading receipt stream\n[{\"id\":\"SOL-346892086-1\",\"label\":\"RFQ fill\",\"source\":\"terminal log\",\"sourceTimestamp\":\"2026-06-20T13:24:12Z\",\"slot\":346892086,\"side\":\"buy\",\"notionalUsd\":10000,\"quotePriceUsd\":181.58,\"fillPriceUsd\":181.64,\"markPriceUsd\":181.61,\"bestBid\":181.52,\"bestAsk\":181.71,\"spreadBps\":10.5,\"impactBps\":8.4,\"markout1mBps\":4.2,\"markout5mBps\":-1.7,\"routeLatencyMs\":132,\"priorityFeeMicrolamports\":2200,\"oracleAgeSec\":2.1,\"crankAgeSlots\":24,\"fundingBpsPerHour\":0.82,\"fillQualityScore\":84},{\"id\":\"SOL-346891944-3\",\"label\":\"fallback route\",\"source\":\"terminal log\",\"sourceTimestamp\":\"2026-06-20T13:19:06Z\",\"slot\":346891944,\"side\":\"sell\",\"notionalUsd\":18000,\"quotePriceUsd\":181.08,\"fillPriceUsd\":181,\"markPriceUsd\":181.05,\"bestBid\":180.96,\"bestAsk\":181.13,\"spreadBps\":9.4,\"impactBps\":14.5,\"markout1mBps\":-2.2,\"markout5mBps\":-6.8,\"routeLatencyMs\":176,\"priorityFeeMicrolamports\":2700,\"oracleAgeSec\":2.8,\"crankAgeSlots\":31,\"fundingBpsPerHour\":0.91,\"fillQualityScore\":77}]\n[INFO] complete"
}
